{
  "number": 10,
  "title": "Track adapter issue ingestion coverage",
  "state": "open",
  "body": "We need E2E coverage for issue ingestion and webhook routing.",
  "labels": [
    "bug"
  ],
  "assignees": [
    "monalisa"
  ],
  "author": {
    "avatarUrl": "https://avatars.githubusercontent.com/u/3?v=4",
    "login": "hubot"
  },
  "milestone": null,
  "created_at": "2026-03-25T10:00:00Z",
  "updated_at": "2026-03-28T07:45:00Z",
  "closed_at": null,
  "html_url": "https://github.com/octocat/hello-world/issues/10"
}
